Name,Price,Rating
"15.6” Galaxy Book3 Laptop PC Computer, 13th Gen Intel Core i7-1355U Processor / 16 GB / 512GB, Thin and Light, FHD Screen, Fingerprint Reader, HD Webcam, 2023 Model, NP750XFG-KB2US, Silver",$950.48,4.5
"IdeaPad 1 Student Laptop, 15.6"" FHD Display, Intel Dual Core Processor, 8GB RAM, 128GB SSD + 128GB eMMC, Wi-Fi 6, Webcam, Bluetooth, 1 Year Office 365, Windows 11 Home, Grey",$299.00,4.3
"Laptop Computer -1080P IPS Full HD Laptop,12GB DDR4 512GB SSD Quad-Core Intel Celeron Processors, Pre-Installed Windows 11, USB 3.0, 15.6''Screen, Bluetooth 4.2, 2.4G/5G WiFi, Mini-HDMI",$259.99,4.3
"IdeaPad 2024 Newest Laptop, 15.6"" FHD IPS Touchscreen, 8-Core AMD Ryzen 7 5700U (Beat i7-1180G7), 16GB RAM, 512GB SSD, Radeon Graphics, Webcam,WiFi 6, Long Battery, Win 11 Pro+MarxsolAccessory",$559.00,5.0
"14 Laptop, Intel Celeron N4020, 4 GB RAM, 64 GB Storage, 14-inch Micro-edge HD Display, Windows 11 Home, Thin & Portable, 4K Graphics, One Year of Microsoft 365 (14-dq0040nr, 2021, Snowflake White)",$180.00,3.8
"SAMSUNG 15.6” Galaxy Book3 Laptop PC Computer, 13th Gen Intel Core i7-1355U Processor / 16 GB / 512GB, Thin and Light, FHD Screen, Fingerprint Reader, HD Webcam, 2023 Model, NP750XFG-KB2US, Silver",$950.48,4.5
"SAMSUNG 15.6” Galaxy Book3 Laptop PC Computer, 13th Gen Intel Core i7-1355U Processor / 16 GB / 512GB, Thin and Light, FHD Screen, Fingerprint Reader, HD Webcam, 2023 Model, NP750XFG-KB2US, Silver",$950.48,4.5
"jumper 16 Inch Laptop, 16GB RAM 512GB SSD, Laptops Computer with 12th Intel N100 CPU(3.4GHZ), 1080P FHD IPS Display（1920x1200）, 2.4G/5G WiFi, 4 Stereo Speakers, Cooling System, 38WH Battery, Type-C.",$379.98,4.5
"Lenovo IdeaPad 3 Touchscreen Business Laptop, Intel Core i5-1135G7, 15.6"" FHD IPS Touchscreen, Wi-Fi 6, HDMI, SD Card Reader, 12hrs Video Playback, Windows 11 Home (20GB RAM | 1TB SSD)",$599.00,4.7
"Lenovo 15.6"" IdeaPad 1 Laptop, 20GB Memory, 1TB SSD Storage, Intel Pentium Processor (4-cores, 3.3GHz), 15.6"" Anti-glare Display, Wi-Fi 6 and Bluetooth, HDMI, Type-C, 1 Year Office 365,Windows 11 Home",$399.87,4.2
"Laptop 16 inch Windows 11 Pro, VocBook 16, Intel 12th Gen N95, Up to 3.4GHz, 16GB DDR5 RAM, 1TB PCIE NVME SSD, 16"" FHD IPS 1920x1200, 2.0MP, 2.4G+5G WiFi, BT 5.0, HDMI, RJ45, Type C, Gray",$389.99,4.4
"2024 Latest 15.6'' Laptop with 2.0GHz Intel Processor(up to 2.9GHz), 16GB DDR4 RAM, 512GB SSD, Windows 11 Laptop Computer with IPS FHD 1080P Display, 5G/2.4Ghz WiFi, USB 3.0, Bluetooth 4.2",$289.99,3.9
"V15 Laptop, 15.6"" FHD Display, AMD Ryzen 5 5500U Hexa-core Processor (Beat Intel i7-1065G7), 16GB RAM, 1TB SSD, HDMI, RJ45, Numeric Keypad, Wi-Fi, Windows 11 Pro, Black",$470.00,4.3
"Portable Laptop, Student and Business, 14"" HD Display, Intel Quad-Core N4120, 8GB DDR4 RAM, 64GB eMMC, 1 Year Office 365, Webcam, RJ-45, HDMI, Wi-Fi, Windows 11 Home, Silver",$219.00,4.1
"2023 Newest Inspiron Laptop, 15.6"" FHD IPS Touchscreen, Intel Core i5-1155G7(Beats i7-1065G7) Processor (Quad-core), 16GB RAM, 512GB SSD, Wi-Fi, Bluetooth, Windows 11 Home, Carbon Black",$461.69,3.9
"Notebook Laptop, 15.6"" HD Touchscreen, Intel Core i3-1115G4 Processor, 32GB RAM, 1TB PCIe SSD, Webcam, Type-C, HDMI, SD Card Reader, Wi-Fi, Windows 11 Home, Silver",$484.00,4.3
"15.6"" Full HD 1080p IPS Laptop Computer, Intel Celeron N5095 Quad-Core Processors,12GB RAM, 512GB ROM, USB 3.0, Bluetooth 4.2,Pre-Install Windows 11,Mini HDMI, 2.4/5G WiFi, USB-A&C",$209.99,3.8
"Vivobook Go 12 L210 11.6” ultra-thin laptop, 2022 version, Intel Celeron N4020, 4GB RAM, 64GB eMMC, Win 11 Home in S mode with One Year of Office 365 Personal, L210MA-DS02",$149.99,3.9
"Aspire 5 Laptop Business Computer, 15.6"" FHD Display, Intel Core i5-12450H 8-Core Processor, 16GB RAM, 1TB SSD, Webcam, HDMI, RJ-45, Bluetooth, Wi-Fi 6, Windows 11, GM Accessory",$579.99,4.7
"15.6"" Portable Laptop (Include 1 Year Microsoft 365), HD Display, Intel Quad-Core N200 Processor, 16GB RAM, 128GB Storage, Wi-Fi 6, Webcam, HDMI, Numeric Keypad, Windows 11 Home, Silver",$305.00,4.3
"Surface Laptop Go 3 (2023) - 12.4"" Touchscreen, Thin & Lightweight, Intel Core i5, 8GB RAM, 256GB SSD SSD, with Windows 11, Ice Blue Color",$694.99,4.5
"Newest 15.6 FHD IPS Flagship Laptop, 11th Gen Intel 4-Core i5-1135G7(Up to 4.2GHz, Beat i7-1060G7), 16GB RAM, 512GB PCIe SSD, Iris Xe Graphics, Bluetooth, WiFi, Win11.ELMTech",$472.98,5.0
"15.6"" Touchscreen Flagship HD Laptop for Business, Intel i3-1115G4 up to 4.1GHz (Beat i5-1035G4), 16GB RAM, 512GB NVMe SSD, Fast Charge, Numpad, Bluetooth, Wi-Fi, HDMI, Win 11,w/GM Accessories",$449.99,4.4
"hp Newest 15.6'' Anti-Glare HD Laptop, Intel Quad-core Processor, 16GB RAM, 128GB SSD+ 128GB USB Storage, Office 365 1-Year, Up to 11 hrs Long Battery, Win11 S, Silver",$349.00,4.5
"Laptop, 17"" IPS Full HD Display Laptops Computer, 8GB RAM 256GB SSD Notebook with Intel Celeron Quad-core Processor, Mini HDMI, Webcam, Dual Wi-Fi, 8000 mAh Battery",$269.98,4.8
